<!-- QUALYS HOST_LIST_VM_DETECTION_OUTPUT DTD -->
<!-- $Revision: 57757 $ -->
<!ELEMENT HOST_LIST_VM_DETECTION_OUTPUT (REQUEST?,RESPONSE)>

<!ELEMENT REQUEST (DATETIME, USER_LOGIN, RESOURCE, PARAM_LIST?, POST_DATA?)>
<!ELEMENT DATETIME (#PCDATA)>
<!ELEMENT USER_LOGIN (#PCDATA)>
<!ELEMENT RESOURCE (#PCDATA)>
<!ELEMENT PARAM_LIST (PARAM+)>
<!ELEMENT PARAM (KEY, VALUE)>
<!ELEMENT KEY (#PCDATA)>
<!ELEMENT VALUE (#PCDATA)>
<!-- if returned, POST_DATA will be urlencoded -->
<!ELEMENT POST_DATA (#PCDATA)>

<!ELEMENT RESPONSE (DATETIME, HOST_LIST?, WARNING?)>
<!ELEMENT HOST_LIST (HOST+)>
<!ELEMENT HOST (ID, IP?, TRACKING_METHOD?, OS?, DNS?, NETBIOS?,
                LAST_SCAN_DATETIME?, DETECTION_LIST)>
<!ELEMENT ID (#PCDATA)>
<!ELEMENT IP (#PCDATA)>
<!ELEMENT TRACKING_METHOD (#PCDATA)>
<!ELEMENT OS (#PCDATA)>
<!ELEMENT DNS (#PCDATA)>
<!ELEMENT NETBIOS (#PCDATA)>
<!ELEMENT LAST_SCAN_DATETIME (#PCDATA)>
<!ELEMENT DETECTION_LIST (DETECTION+)>
<!ELEMENT DETECTION (QID, TYPE, PORT?, PROTOCOL?, FQDN?, SSL?, RESULTS?,
                     STATUS?, FIRST_FOUND_DATETIME?, LAST_FOUND_DATETIME?,
                     LAST_TEST_DATETIME?, LAST_UPDATE_DATETIME?)>
<!ELEMENT QID (#PCDATA)>
<!ELEMENT TYPE (#PCDATA)>
<!ELEMENT PORT (#PCDATA)>
<!ELEMENT PROTOCOL (#PCDATA)>
<!ELEMENT FQDN (#PCDATA)>
<!ELEMENT SSL (#PCDATA)>
<!ELEMENT RESULTS (#PCDATA)>
<!ELEMENT STATUS (#PCDATA)>
<!ELEMENT FIRST_FOUND_DATETIME (#PCDATA)>
<!ELEMENT LAST_FOUND_DATETIME (#PCDATA)>
<!ELEMENT LAST_TEST_DATETIME (#PCDATA)>
<!ELEMENT LAST_UPDATE_DATETIME (#PCDATA)>
<!ELEMENT WARNING (CODE?, TEXT, URL?)>
<!ELEMENT CODE (#PCDATA)>
<!ELEMENT TEXT (#PCDATA)>
<!ELEMENT URL (#PCDATA)>
<!-- EOF -->
